[
 {
  "act_id": "A1909-7",
  "title": "THE ANAND MARRIAGE ACT, 1909",
  "act_number": "ACT NO. 7 OF 1909",
  "enactment_date": "[22nd October, 1909.]",
  "jurisdiction": "IN-CENTRAL",
  "category": "general",
  "structure": "sections",
  "is_repealed": false,
  "repealed_by": null,
  "repeal_reason": null,
  "chapter_count": 0,
  "section_count": 6,
  "footnote_count": 4,
  "source_file": "190907.json"
 },
 {
  "act_id": "A1860-45",
  "title": "THE INDIAN PENAL CODE",
  "act_number": "ACT NO. 45 OF 1860",
  "enactment_date": "[6th October, 1860.]",
  "jurisdiction": "IN-CENTRAL",
  "category": "criminal",
  "structure": "chapters",
  "is_repealed": true,
  "repealed_by": "A2023-45",
  "repeal_reason": "Repealed and replaced by Bharatiya Nyaya Sanhita, 2023 (Act No. 45 of 2023) w.e.f. 01-07-2024 (with savings under s. 358)",
  "chapter_count": 26,
  "section_count": 6,
  "footnote_count": 17,
  "source_file": "A1860-45.json"
 },
 {
  "act_id": "A1872-1",
  "title": "THE INDIAN EVIDENCE ACT, 1872",
  "act_number": "ACT NO. 1 OF 1872",
  "enactment_date": "[15th March, 1872.]",
  "jurisdiction": "IN-CENTRAL",
  "category": "criminal",
  "structure": "parts",
  "is_repealed": true,
  "repealed_by": "A2023-47",
  "repeal_reason": "Repealed and replaced by Bharatiya Sakshya Adhiniyam, 2023 (Act No. 47 of 2023) w.e.f. 01-07-2024 (with savings under s. 170)",
  "chapter_count": 0,
  "section_count": 1,
  "footnote_count": 0,
  "source_file": "A1872-1.json"
 },
 {
  "act_id": "A2023-45",
  "title": "THE BHARATIYA NYAYA SANHITA, 2023",
  "act_number": "ACT NO. 45 OF 2023",
  "enactment_date": "[25th December, 2023.]",
  "jurisdiction": "IN-CENTRAL",
  "category": "criminal",
  "structure": "chapters",
  "is_repealed": false,
  "repealed_by": null,
  "repeal_reason": null,
  "chapter_count": 20,
  "section_count": 1,
  "footnote_count": 1,
  "source_file": "A2023-45.json"
 },
 {
  "act_id": "A2023-47",
  "title": "THE BHARATIYA SAKSHYA ADHINIYAM, 2023",
  "act_number": "ACT NO. 47 OF 2023",
  "enactment_date": "[25th December, 2023.]",
  "jurisdiction": "IN-CENTRAL",
  "category": "criminal",
  "structure": "chapters",
  "is_repealed": false,
  "repealed_by": null,
  "repeal_reason": null,
  "chapter_count": 12,
  "section_count": 1,
  "footnote_count": 0,
  "source_file": "A2023-47.json"
 }
]
